LocationID,OrganisationCode,LocationNameEN,VenueTypeEN,AddressEN,Latitude,Longitude,SSID,NumberOfHotspots,MoreInformationEN,MoreInformationLinkEN,InWifiMap
0003,hkied,The Education University of Hong Kong,University & Tertiary Institutes,"Ground Floor, Block D, The Education University of Hong Kong (Tai Po Campus), 10 Lo Ping Road",22.4692,114.1953,Wi-Fi.HK via EdUHK,13,,,False
1003,hanglung,Gala Place,Stores/Shopping Malls,"BF-2F, Gala Place, 56 Dundas Street, Mongkok",22.315223,114.171124,Wi-Fi.HK via Gala Place,22,,,False
1006,hanglung,Fashion Walk 9 Kingston,Stores/Shopping Malls,"BF-1F, 9 Kingston Street, Fashion Walk, Causeway Bay",22.281992,114.185971,Wi-Fi.HK via FashionWalk,47,,,False
10134,PCCW,Circle K,Convenience Stores,"Shop No. LG09 on the Lower Ground Floor, The Laguna Mall, 8 Laguna Verde Avenue, Hung Hom, Kowloon",22.3092124373,114.191470742,Wi-Fi.HK via CSL,1,,,False
10602,PCCW,Circle K,Convenience Stores,"Shop B2-C G/F Luen Wai Apartments,No 136, 136A, 138, 140-142 Belchers Street,No 7-7A Davis Street, HK",22.2823097732,114.127088338,Wi-Fi.HK via CSL,1,,,False
11175,PCCW,VanGo,Convenience Stores,FT 202 LG2/F COMM CTR SHEK YAM EST KWAI CHUNG NEW TERRITORIES,22.3714480102,114.138438105,Wi-Fi.HK via CSL,1,,,False
11266,PCCW,Discovery Bay Club,Entertainment & Leisure,1/F - Outside of Restaurant Sundeck,22.2931677514,114.023993611,Wi-Fi.HK via CSL,1,,,False
11601,PCCW,VanGo,Convenience Stores,FT 5 G/F CAUSEWAY CTR 28 HARBOUR ROAD       WAN CHAI HONG KONG,22.2806381901,114.176304191,Wi-Fi.HK via CSL,1,,,False
11894,PCCW,Circle K,Convenience Stores,FT 13A&E G/F FU SHING BLDG SAI CHING STREET           YUEN LONG NEW TERRITORIES,22.4423898061,114.027869403,Wi-Fi.HK via CSL,1,,,False
11926,PCCW,Circle K,Convenience Stores,FT P8 LUK YEUNG GALLERIA  LUK YEUNG SUN CHUEN       TSUEN WAN NEW TERRITORIES,22.3728270695,114.119874536,Wi-Fi.HK via CSL,1,,,False
133607,PCCW,Mong Kok Stadium,"Sports, Cultural & Recreational Venues","37 Flower Market Road, Mong Kok, Kowloon",22.325663,114.173004,Wi-Fi.HK via CSL,6,Hotspot Location in Venue,https://theme.gov.hk/en/theme/wifi/images/coverage/133607_Mong Kok Stadium_Hotspot_Diagram.pdf,False
133774,PCCW,Hong Kong Coliseum,"Sports, Cultural & Recreational Venues","9 Cheong Wan Road,  Hung Hom",22.301652,114.182064,Wi-Fi.HK via CSL,13,Hotspot Location in Venue,https://theme.gov.hk/en/theme/wifi/images/coverage/Hong Kong Coliseum_hotspot_diagram.pdf,False
134193,PCCW,Lo Wu Control Point,Transportation/Boundary & Related Facilities,"Lo Wu Control Point, Lo Wu Station Road, Lo Wu",22.529473,114.113475,Wi-Fi.HK via CSL,19,Hotspot Location in Venue,https://theme.gov.hk/en/theme/wifi/images/coverage/Lo Wu Control Point_Hospot_Diagram.pdf,False
15766327,hkt,PENTECOSTAL SCHOOL,Schools & Learning/Study Centres,"14 Perth Street, Ho Man Tin, KLN",22.321087,114.181183,Wi-Fi.HK via HKT,49,,,False
15770608,hkt,The IMC SKH Tin Shui Wai Ling Oi Primary School,Schools & Learning/Study Centres,"82 Tin Shui Road, Tin Shui Wai",22.467902,114.00102,Wi-Fi.HK via HKT,5,,,False
15880423,hkt,CCC Kei Yuen College,Schools & Learning/Study Centres,Fung Yau Street East,22.441946,114.035281,Wi-Fi.HK via HKT,2,,,False
16017651,hkt,Ma Tau Chung Government Primary School,Schools & Learning/Study Centres,1 Fuk Cheung Street,22.32462,114.186689,Wi-Fi.HK via HKT,2,,,False
1714,PCCW,Circle K,Convenience Stores,"Shop 22, G/F., Chevalier Garden Shopping Ctr, Ma On Shan, Shatin, N.T.",22.4049433789,114.223152995,Wi-Fi.HK via CSL,1,,,False
1716,PCCW,Circle K,Convenience Stores,"Shop 1, Carpark Bldg., Ko Chun Court, Yau Tong, Kln.",22.2979114925,114.242325425,Wi-Fi.HK via CSL,1,,,False
1719,PCCW,Circle K,Convenience Stores,"Shop 1, On Yam Shopping Ctr, On Yam Est, Kwai Chung, N.T.",22.3707435933,114.141694307,Wi-Fi.HK via CSL,1,,,False
1722,PCCW,Circle K,Convenience Stores,"7/F., Centre A, Asia Terminals Centre, Berth 3, Kwai Chung Container Terminal, Kwai Chung",22.34236584,114.1229462,Wi-Fi.HK via CSL,1,,,False
1726,PCCW,Circle K,Convenience Stores,"Shop 2B-03, Level 3, Waldorf Avenue, No.1 Tuen Lee Street, Tuen Mun",22.39198784,113.97794167,Wi-Fi.HK via CSL,1,,,False
1733,PCCW,Circle K,Convenience Stores,"Shop 12 G/F., Yung Shing Shopping Centre, Yung Shing Court, Fanling N.T.",22.4829439186,114.139001369,Wi-Fi.HK via CSL,1,,,False
1739,PCCW,Circle K,Convenience Stores,"Shop 6, King Lam Shopping Ctr., King Lam Est., Tseung Kwan O, Kln.",22.3207308167,114.261444211,Wi-Fi.HK via CSL,1,,,False
1741,PCCW,Circle K,Convenience Stores,"Shop 1, G/F., Lei Yue Mun Plaza, Yau Tong Estate, Kowloon",22.2968642352,114.23936963,Wi-Fi.HK via CSL,1,,,False
1743,PCCW,Circle K,Convenience Stores,"Shop 7 & 8, Town Ctr, Wah Fu Est, H.K.",22.2503253375,114.136973619,Wi-Fi.HK via CSL,1,,,False
1753,PCCW,Circle K,Convenience Stores,"Portion of Workshop B, G/F., On Shing Industrial Building, Nos.2-16 Wo Liu Hang Road, Fo Tan, Shatin",22.397196463,114.196942448,Wi-Fi.HK via CSL,1,,,False
1759,PCCW,Circle K,Convenience Stores,"Shop E G/F., & C/L., Nos.42-44 Kweilin Street, Sham Shui Po, Kowloon",22.3284571761,114.159343242,Wi-Fi.HK via CSL,1,,,False
1767,PCCW,Circle K,Convenience Stores,"Shop 3C, G/F., Fu Shun Hse, Fu Shan Est, Kln.",22.342653308,114.209173321,Wi-Fi.HK via CSL,1,,,False
1779,PCCW,Circle K,Convenience Stores,"Shop No.6, G/F., Po Tin Shopping Centre, Tuen Mun",22.4094613872,113.966626524,Wi-Fi.HK via CSL,1,,,False
1783,PCCW,Circle K,Convenience Stores,"Shop No.18 G/F., Island Resort Mall, 28 Siu Sai Wan Road, Siu Sai Wan, Hong Kong",22.2666591512,114.250280857,Wi-Fi.HK via CSL,1,,,False
1785,PCCW,Circle K,Convenience Stores,"Shops 109 & 110 Tin Yan Shopping Centre, Tin Shui Wai, N.T.",22.46261,113.99671,Wi-Fi.HK via CSL,1,,,False
1790,PCCW,Circle K,Convenience Stores,"Shop 102, Comm. Ctr, Kin Sang Est, Tuen Mun, N.T.",22.4070461804,113.969544768,Wi-Fi.HK via CSL,1,,,False
1792,PCCW,Circle K,Convenience Stores,"Shop 1, Wan Tau Tong Square, Tai Po, N.T.",22.4422088339,114.166907072,Wi-Fi.HK via CSL,1,,,False
1801,PCCW,Circle K,Convenience Stores,"Shop No.23 G/F.,Sai Kung Building, Lot No.985 in DD215 Sai Kung",22.3823511346,114.272409081,Wi-Fi.HK via CSL,1,,,False
1803,PCCW,Circle K,Convenience Stores,"Shop 209-210, Wo Hing Hse, Hing Wah Est (II), Chai Wan, H.K.",22.2629159471,114.233184456,Wi-Fi.HK via CSL,1,,,False
1806,PCCW,Circle K,Convenience Stores,"Shop no. 1, G/F., Yuk Ping Hse, Long Ping Estate, Y.L. N.T.",22.4511084171,114.023532271,Wi-Fi.HK via CSL,1,,,False
1808,PCCW,Circle K,Convenience Stores,"Shop no. 19, Ming Tak Shopping Ctr, Ming Tak Est, Tseung Kwan O, Kln.",22.3167607803,114.268675446,Wi-Fi.HK via CSL,1,,,False
1812,PCCW,Circle K,Convenience Stores,"Shop 1 G/F., Carpark Building, Ying Fuk Court, Kowloon",22.3465084917,114.19563353,Wi-Fi.HK via CSL,1,,,True
1823,PCCW,Circle K,Convenience Stores,"Shop 1 Carpark Building, Sau Mau Ping Estate Phase 15, Kwun Tong",22.3219168431,114.230496883,Wi-Fi.HK via CSL,1,,,False
1825,PCCW,Circle K,Convenience Stores,"G/F & Cockloft, 34-35 Praya St., Cheung Chau",22.205653307,114.028247594,Wi-Fi.HK via CSL,1,,,False
1826,PCCW,Circle K,Convenience Stores,"Shop 301 & 302, Choi Wah Hse, Choi Yuen Est, Sheung Shui, N.T.",22.4999343984,114.126421809,Wi-Fi.HK via CSL,1,,,False
1829,PCCW,Circle K,Convenience Stores,"Shop No.4 G/F., Cheong Yuen Apartments, Nos.2,4,6,8 & 8A Tsat Tsz Mui Road, North Point, H.K.",22.2905383367,114.200799465,Wi-Fi.HK via CSL,1,,,False
1840,PCCW,Circle K,Convenience Stores,"Shop Nos.16-17 G/F., Oceania Heights, No.2 Hoi Chu Road, Tuen Mun, N.T.",22.3838937734,113.971400856,Wi-Fi.HK via CSL,1,,,False
1846,PCCW,Circle K,Convenience Stores,"Shop no. 6, G/F., Chau Kwai House, Kwai Chung Estate Phase 1, N.T.",22.3672561814,114.130305647,Wi-Fi.HK via CSL,1,,,False
1851,PCCW,Circle K,Convenience Stores,"Shop Nos. A, B & C G/F., Pier 3, 11 Man Kwong Street, Central, HK",22.2879920135,114.157575666,Wi-Fi.HK via CSL,1,,,False
1869,PCCW,Circle K,Convenience Stores,KIOSK TIH 2 at Tin Hau MTR Station,22.28239,114.19173,Wi-Fi.HK via CSL,1,,,False
1873,PCCW,Circle K,Convenience Stores,"Shop 355A, Level 2, Zone E, Tai Po Mega Mall, 9 On Pong Road, Tai Po",22.451519916,114.170404672,Wi-Fi.HK via CSL,1,,,False
1874,PCCW,Circle K,Convenience Stores,"Concession Oly 8, Olympic Station, Kowloon",22.31855,114.160055,Wi-Fi.HK via CSL,1,,,False
1875,PCCW,Circle K,Convenience Stores,"Shop 209, Level 2, Metro City Phase III, The Metropolis, Tsuen Kwan O",22.3223932358,114.25642848,Wi-Fi.HK via CSL,1,,,False
1878,PCCW,Circle K,Convenience Stores,"Shop 54, Comm Ctr, Tai Hing Estate, Tuen Mun, N.T.",22.4027314354,113.970301151,Wi-Fi.HK via CSL,1,,,False
1887,PCCW,Circle K,Convenience Stores,"G/F., Kam Pik Hse, Choi Hung Est, Kowloon Bay, Kowloon",22.3349723927,114.2054075,Wi-Fi.HK via CSL,1,,,False
1892,PCCW,Circle K,Convenience Stores,"Shop No.B04 G/F., Park Central, Tong Tak Street, Tseung Kwan O",22.30763128,114.2572942,Wi-Fi.HK via CSL,1,,,False
1894,PCCW,Circle K,Convenience Stores,"Shop 116, G/F., Yiu On Shopping Ctr, Yiu On Est, Ma On Shan, Shatin, N.T.",22.420173092,114.230496883,Wi-Fi.HK via CSL,1,,,False
1900,PCCW,Circle K,Convenience Stores,"Shop No.2 G/F., Tsz Ching Shopping Centre II, Tsz Ching Estate, Tsz Wan Shan, Kowloon",22.349557,114.202258,Wi-Fi.HK via CSL,1,,,False
1906,PCCW,Circle K,Convenience Stores,"Shop LG1, Lei Muk Shue Shopping Centre, Lei Muk Shue Estate, Tsuen Wan",22.3783530908,114.13636744,Wi-Fi.HK via CSL,1,,,False
1910,PCCW,PCCW Phone Booth,Telephone Booths,"Outside Bus Terminus, Lee Yat House, Shun Lee Estate, Kwun Tong",22.331389125,114.22625125,Wi-Fi.HK via CSL,1,,,False
1911,PCCW,PCCW Phone Booth,Telephone Booths,"Outside Bus Terminus, Block C, Cho Yiu Estate, Kwai Chung",22.345889909,114.12885076,Wi-Fi.HK via CSL,1,,,False
1914,PCCW,PCCW Phone Booth,Telephone Booths,"Julimount Garden, conjuction of Hin Tai Street / Hin Hong Street, Shatin",22.362893475,114.17688303,Wi-Fi.HK via CSL,1,,,False
1919,PCCW,PCCW Phone Booth,Telephone Booths,"Marina Cove Shopping Centre, Hiram's Highway, Sai Kung",22.355689948,114.25157805,Wi-Fi.HK via CSL,1,,,False
1922,PCCW,PCCW Phone Booth,Telephone Booths,"Pak Shek Wo Bus Stop, Clear Water Bay, Sai Kung",22.335863033,114.24205539,Wi-Fi.HK via CSL,1,,,False
1923,PCCW,PCCW Phone Booth,Telephone Booths,"Outside Chun Fai Road, Moorsom Road, Jardine's Lookout, Happy Valley",22.272588558,114.19371942,Wi-Fi.HK via CSL,1,,,False
1926,PCCW,PCCW Phone Booth,Telephone Booths,"Outside Po Yan House, Po Lam Estate, Tseung Kwan O",22.326304554,114.25253388,Wi-Fi.HK via CSL,1,,,False
1930,PCCW,PCCW Phone Booth,Telephone Booths,"Outside Block 2 , Waterside Plaza, Wing Shun Street, Tsuen Wan",22.364107619,114.11357209,Wi-Fi.HK via CSL,1,,,False
1938,PCCW,PCCW Phone Booth,Telephone Booths,"Outside On Yat House, Shun On Estate, Kwun Tong",22.327812936,114.22674512,Wi-Fi.HK via CSL,1,,,False
19429,PCCW,Circle K,Convenience Stores,"Shop 30, Wah Fu (II) Commercial Complex, Wah Fu (II) Estate, Hong Kong",22.2530659767,114.136101901,Wi-Fi.HK via CSL,1,,,False
1949,PCCW,PCCW Phone Booth,Telephone Booths,"Outside Entry Gate of Modern terminus Ltd, terminus 8, Kwai Chung",22.3210922397,114.128559421,Wi-Fi.HK via CSL,1,,,False
19552,PCCW,PCCW Phone Booth,Telephone Booths,"1009 Kwai Chung Road, Kwai Chung, New Territories",22.367498641,114.13346395,Wi-Fi.HK via CSL,1,,,False
1957,PCCW,PCCW Phone Booth,Telephone Booths,"Entrance of Pak Kong Village, Sai Kung",22.378921698,114.25905659,Wi-Fi.HK via CSL,1,,,False
1958,PCCW,PCCW Phone Booth,Telephone Booths,"Just Outside Po Lo Che Road / Hiram's Highway, Sai Kung",22.382666541,114.26458371,Wi-Fi.HK via CSL,1,,,False
1961,PCCW,PCCW Phone Booth,Telephone Booths,"Outside Tui Min Hoi Market, Hong Ki Neard, Sai Kung",22.375655278,114.27145389,Wi-Fi.HK via CSL,1,,,False
1969,PCCW,PCCW Phone Booth,Telephone Booths,"Outside Holford Garden, 8 Mei Tin Road, Tai Wai",22.373242307,114.17703808,Wi-Fi.HK via CSL,1,,,False
1976,PCCW,PCCW Phone Booth,Telephone Booths,"Outside Carado Garden, Tin Sam Street, Tai Wai",22.367652477,114.17631977,Wi-Fi.HK via CSL,1,,,False
1979,PCCW,PCCW Phone Booth,Telephone Booths,"Bus Stop (Near Administration Block), Tai Lam Tunnel, Pat Heung Road, Yuen Long",22.4204554,114.06336922,Wi-Fi.HK via CSL,1,,,False
1982,PCCW,PCCW Phone Booth,Telephone Booths,"Outside Sewage Treatment Works, Siu Hong Road, Tuen Mun",22.41414931,113.9783926,Wi-Fi.HK via CSL,1,,,False
1984,PCCW,PCCW Phone Booth,Telephone Booths,"Opposite to Block A, Tai Po Garden, Mui Shui Hang Road, Tai Po",22.453844872,114.15377805,Wi-Fi.HK via CSL,1,,,False
1985,PCCW,PCCW Phone Booth,Telephone Booths,"Outside LRT Hang Mei Tsuen Station, Ping Ha Road, Tin Shui Wai",22.444956583,114.00580065,Wi-Fi.HK via CSL,1,,,False
1986,PCCW,PCCW Phone Booth,Telephone Booths,Outside LRT Tong Fong Tsuen Station,22.440334673,114.00727327,Wi-Fi.HK via CSL,1,,,False
1993,PCCW,PCCW Phone Booth,Telephone Booths,"Outside Eldo Shopping Centre, Tuen Mun Heung Sze Wui Road, Tuen Mun",22.398089356,113.97517238,Wi-Fi.HK via CSL,1,,,False
2011,PCCW,PCCW Phone Booth,Telephone Booths,"Outside Lei Yue Mun Public Library, Near Taxi Stand, Kwun Tong",22.292337731,114.23805791,Wi-Fi.HK via CSL,1,,,False
2018,PCCW,PCCW Phone Booth,Telephone Booths,"Outside Lee On Road Playground, Fire Station, Kwun Tong",22.331191316,114.22305775,Wi-Fi.HK via CSL,1,,,False
2026,PCCW,PCCW Phone Booth,Telephone Booths,"Outside Indian Club, Caroline Hill Road, Causeway Bay",22.274593677,114.18796597,Wi-Fi.HK via CSL,1,,,False
2031,PCCW,PCCW Phone Booth,Telephone Booths,"Turtle Cove Beach, Repulse Bay",22.233463356,114.22326133,Wi-Fi.HK via CSL,1,,,False
2032,PCCW,PCCW Phone Booth,Telephone Booths,"Conjunction of Tseuk Kiu Street / Tat Chee Avenue, Kowloon Tong, Shum Shui Po District, Kowloon",22.331657229,114.17543767,Wi-Fi.HK via CSL,1,,,False
2033,PCCW,PCCW Phone Booth,Telephone Booths,"Cherry Street, Tai Kok Tsui",22.3175069571,114.157047588,Wi-Fi.HK via CSL,1,,,False
2041,PCCW,PCCW Phone Booth,Telephone Booths,"Conjunction of  Tsui Lam Road / Po Lam Road North, Tseung Kwan O",22.322603188,114.24996963,Wi-Fi.HK via CSL,1,,,False
2043,PCCW,PCCW Phone Booth,Telephone Booths,"Castle Peak Road-Kwai Chung, Gas Station, Ha Kwai Chung",22.351625491,114.13296478,Wi-Fi.HK via CSL,1,,,False
2058,PCCW,PCCW Phone Booth,Telephone Booths,"Outside University MTR Station, Chak Cheung Street, Ma On Shan",22.412801683,114.21049533,Wi-Fi.HK via CSL,1,,,False
2083,PCCW,PCCW Phone Booth,Telephone Booths,Outside Sheung Shui Wai Tsuen Community Centre,22.509472355,114.12349283,Wi-Fi.HK via CSL,1,,,False
2089,PCCW,PCCW Phone Booth,Telephone Booths,"Outside Franki Centre, 320 Junction Road, Kowloon Tong",22.339224823,114.18097039,Wi-Fi.HK via CSL,1,,,False
2108,PCCW,PCCW Phone Booth,Telephone Booths,"Conjunction of Winslow Street / Gillies Avenue, To Kwa Wan",22.306173386,114.18359069,Wi-Fi.HK via CSL,1,,,False
2112,PCCW,PCCW Phone Booth,Telephone Booths,"Outside Bus Terminus, Kowloon City Ferry Pier, Kowloon City",22.317777024,114.19393704,Wi-Fi.HK via CSL,1,,,False
2125,PCCW,PCCW Phone Booth,Telephone Booths,"Near Carpark Building, Yan Ming Court, Tseung Kwan O",22.325010254,114.25892951,Wi-Fi.HK via CSL,1,,,False
2149,PCCW,PCCW Phone Booth,Telephone Booths,Outside 464 Prince Edward Road West/Tak Ku Ling Road,22.328252513,114.19148231,Wi-Fi.HK via CSL,1,,,False
2151,PCCW,PCCW Phone Booth,Telephone Booths,"Outside Bus Stop, Wong Tung House, Tung Lung Road, Kowloon City",22.334068012,114.19290963,Wi-Fi.HK via CSL,1,,,False
2155,PCCW,PCCW Phone Booth,Telephone Booths,"Outside Wah Shun Garden, 898 King's Road, Quarry Bay, Hong Kong",22.287260988,114.2101293,Wi-Fi.HK via CSL,1,,,False
2157,PCCW,PCCW Phone Booth,Telephone Booths,"Outside Tai Tan Country Park, Visitor Centre, Pak Tam Road, Sai Kung",22.436986986,114.33438087,Wi-Fi.HK via CSL,1,,,False
2158,PCCW,PCCW Phone Booth,Telephone Booths,"Conjuction of Tsuen Fu Street / Tsuen Wah Street, Tsuen Wan",22.374276913,114.11621788,Wi-Fi.HK via CSL,1,,,False
2163,PCCW,PCCW Phone Booth,Telephone Booths,"Bus Terminus, Kwai Shing West Estate, Kwai Chung",22.36116697,114.12191316,Wi-Fi.HK via CSL,1,,,False
2165,PCCW,PCCW Phone Booth,Telephone Booths,"Outside Caritas Clinic, Chung On Street, Yeung Uk Road, Tsuen Wan",22.368072889,114.11584209,Wi-Fi.HK via CSL,1,,,False
2169,PCCW,PCCW Phone Booth,Telephone Booths,"Outside Kwai Ching House, Kwai Fong Estate, Kwai Chung",22.358205673,114.12378812,Wi-Fi.HK via CSL,1,,,False
2174,PCCW,PCCW Phone Booth,Telephone Booths,"Conjunction of Hong Ning Road / ShunYan Street, Kwun Tong",22.316029081,114.22354819,Wi-Fi.HK via CSL,1,,,False
2184,PCCW,PCCW Phone Booth,Telephone Booths,"Outside Tsui On House, Tsui Ping Estate, Kwun Tong",22.314736086,114.22940012,Wi-Fi.HK via CSL,1,,,False
2191,PCCW,PCCW Phone Booth,Telephone Booths,"Kwun Tong Ferry Pier, Kwun Tong",22.307387442,114.22158519,Wi-Fi.HK via CSL,1,,,False
2192,PCCW,PCCW Phone Booth,Telephone Booths,"Conjunction of Kwun Tong Road / Lai Yip Street, Kwun Tong",22.314504266,114.21813215,Wi-Fi.HK via CSL,1,,,False
2205,PCCW,PCCW Phone Booth,Telephone Booths,"Conjuction of Tung Chau Street / Cheung Sha Wan Road, Shum Shui Po",22.336954561,114.14672447,Wi-Fi.HK via CSL,1,,,False
2208,PCCW,PCCW Phone Booth,Telephone Booths,"Outside HK Bank, 777 Cheung Sha Wan Road, Cheung Sha Wan",22.337975756,114.15050994,Wi-Fi.HK via CSL,1,,,False
2209,PCCW,PCCW Phone Booth,Telephone Booths,"Outside Lai Chi Kok Training Centre, Lai Wan Road, Lai Chi Kok",22.339688857,114.13859898,Wi-Fi.HK via CSL,1,,,False
2211,PCCW,PCCW Phone Booth,Telephone Booths,"Outside Wo Hing Building, 27B Hing Wah Street, Shum Shui Po",22.339547882,114.1553146,Wi-Fi.HK via CSL,1,,,False
2219,PCCW,PCCW Phone Booth,Telephone Booths,"Bus Terminus, Kam Ying Court, Ma On Shan",22.423197606,114.23702339,Wi-Fi.HK via CSL,1,,,False
2220,PCCW,PCCW Phone Booth,Telephone Booths,"Bus Terminus, Heng On Estate, Ma On Shan",22.418071163,114.22831891,Wi-Fi.HK via CSL,1,,,False
2221,PCCW,PCCW Phone Booth,Telephone Booths,"Near Main Entrance, Wu Kai Sha YMCA Youth Village, On Chun Street, Ma On Shan",22.4270817758,114.233664196,Wi-Fi.HK via CSL,1,,,False
2228,PCCW,PCCW Phone Booth,Telephone Booths,"Outside Chung On Shopping Centre, Chung On Street, Ma On Shan",22.422733,114.226687,Wi-Fi.HK via CSL,1,,,False
2233,PCCW,PCCW Phone Booth,Telephone Booths,"Outside City Garden, City Garden Road, North Point",22.290243169,114.19362398,Wi-Fi.HK via CSL,1,,,False
2235,PCCW,PCCW Phone Booth,Telephone Booths,"Outside Choi Yuet House, Choi Ha Estate, Ngau Tau Kok",22.32639746,114.21768881,Wi-Fi.HK via CSL,1,,,False
2241,PCCW,PCCW Phone Booth,Telephone Booths,"Bus terminus, Lok Wah (North) Estate, Kwun Tong",22.320906238,114.22072528,Wi-Fi.HK via CSL,1,,,False
2247,PCCW,PCCW Phone Booth,Telephone Booths,"Outside Wo Hop Shek Carpark, Ming Yin Road, Fanling",22.481421955,114.14652383,Wi-Fi.HK via CSL,1,,,False
2257,PCCW,PCCW Phone Booth,Telephone Booths,"Outside Block 17, Parc Oasis Tat Chee Avenue, Kowloon Tong",22.3353868,114.17551518,Wi-Fi.HK via CSL,1,,,False
22600,LTKFWA,Lam Tin Kai Fong Welfare Association Neighbourhood Elderly Centre,Welfare Service Units,"Unit No 1-3, G/F, Kwong Yat House, Kwong Tin Estate, Lam Tin, Kowloon",22.302833,114.240806,WI-FI.HK VIA LTKFWA,2,,,False
2261,PCCW,PCCW Phone Booth,Telephone Booths,"Outside Shek Kip Mei Community Hall, Nam Cheong Street, Shek Kip Mei",22.33226,114.16593,Wi-Fi.HK via CSL,1,,,False
2263,PCCW,PCCW Phone Booth,Telephone Booths,"Outside Wah Chak House, Chak On Estate, Shum Shui Po",22.340551422,114.16417704,Wi-Fi.HK via CSL,1,,,False
2264,PCCW,PCCW Phone Booth,Telephone Booths,"Opposite to Shek Kip Mei Police Station, Shek Kip Mei",22.333499097,114.16910886,Wi-Fi.HK via CSL,1,,,False
2278,PCCW,PCCW Phone Booth,Telephone Booths,"Outside Shun Tak Centre, Connaught Road Central, Sheung Wan",22.287721454,114.15138446,Wi-Fi.HK via CSL,1,,,False
2290,PCCW,PCCW Phone Booth,Telephone Booths,"Conjunction of Anchor Street Park /  Oak Street, Tai Kok Tsui",22.319627892,114.16401455,Wi-Fi.HK via CSL,1,,,False
2298,PCCW,PCCW Phone Booth,Telephone Booths,"Conjunction of Wong Chuk Street / Cheung Sha Wan Road, Sham Shui Po",22.328179855,114.16537239,Wi-Fi.HK via CSL,1,,,False
2304,PCCW,PCCW Phone Booth,Telephone Booths,"Conjunction of 3 Arran Street / Shanghai Street, Mong Kok",22.322689511,114.1671686,Wi-Fi.HK via CSL,1,,,False
2305,PCCW,PCCW Phone Booth,Telephone Booths,"Outside Chow Clansmen Ass School, 16 Sycamore Street, Tai Kok Tsui",22.324495329,114.16429543,Wi-Fi.HK via CSL,1,,,False
23090,PCCW,Discovery Bay Recreation Club,Entertainment & Leisure,"Near VIP Room, Chinese Restaurant, 1/F, Discovery Bay Recreation Club, Discovery Bay, Lantau Island",22.2960257002,114.015836312,Wi-Fi.HK via CSL,1,,,False
2314,PCCW,PCCW Phone Booth,Telephone Booths,"Outside Kam Shan Building, Tai Wai Road, Tai Wai",22.374560785,114.17962077,Wi-Fi.HK via CSL,1,,,False
2315,PCCW,PCCW Phone Booth,Telephone Booths,"Outside Tai Wai Market, Mei Tin Rpad, Tai Wai",22.376908582,114.17506691,Wi-Fi.HK via CSL,1,,,False
2317,PCCW,PCCW Phone Booth,Telephone Booths,"Outside Lui Ming Choi Secondary School, Yuen Wo Road, Shatin",22.383988084,114.19269054,Wi-Fi.HK via CSL,1,,,False
23212,PCCW,Discovery Bay Club Siena,Entertainment & Leisure,"Sundeck Fitness Centre, 1/F, Club Siena, Siena Ave, Discovery Bay, Lantau Island",22.3049520052,114.015032,Wi-Fi.HK via CSL,1,,,False
2329,PCCW,PCCW Phone Booth,Telephone Booths,"Petrol Stn, Lam Kam Road, Kam Sheung Road, Pat Heung, Yuen Long",22.431758496,114.10348601,Wi-Fi.HK via CSL,1,,,False
2341,PCCW,PCCW Phone Booth,Telephone Booths,"Outside Tung Chi Hse, TungYuk Centre, Oi Kan Road Bus Terminus, Shau Kei Wan",22.282768784,114.22752611,Wi-Fi.HK via CSL,1,,,False
2343,PCCW,PCCW Phone Booth,Telephone Booths,"Lido Beach Near Public Beach House, Sham Tseng",22.372094678,114.07165311,Wi-Fi.HK via CSL,1,,,False
2350,PCCW,PCCW Phone Booth,Telephone Booths,"Outside Lei Cheng Uk Arcade, Po On Road, Cheung Sha Wan",22.338518851,114.1582366,Wi-Fi.HK via CSL,1,,,False
2351,PCCW,PCCW Phone Booth,Telephone Booths,"Outside Lai Ho House, Lai Kok Estate, Cheung Sha Wan Road",22.333976499,114.1578976,Wi-Fi.HK via CSL,1,,,False
2365,PCCW,PCCW Phone Booth,Telephone Booths,"Yeung Siu Hang Garden, Tsing Wun Road, Tuen Mun",22.393924817,113.96701173,Wi-Fi.HK via CSL,1,,,False
2378,PCCW,PCCW Phone Booth,Telephone Booths,"LRT Ngan Wai Station, Affluence Garden, Tuen Mun",22.402585688,113.97457336,Wi-Fi.HK via CSL,1,,,False
2379,PCCW,PCCW Phone Booth,Telephone Booths,"Outside Leung Chi House Leung King Estate, Tuen Mun",22.405405635,113.96272105,Wi-Fi.HK via CSL,1,,,False
2384,PCCW,PCCW Phone Booth,Telephone Booths,"Outside Tsing Shan Tsuen, Yeung Tsing Road, Tuen Mun",22.390564593,113.96629829,Wi-Fi.HK via CSL,1,,,False
2394,PCCW,PCCW Phone Booth,Telephone Booths,"Outside Block B, Beautiful Garden, Chui Lok Street, Tai Po",22.454397188,114.16464908,Wi-Fi.HK via CSL,1,,,False
24021,PCCW,Discovery Bay Golf Club,Entertainment & Leisure,"Driving Range, Discovery Bay Golf Club, Discovery Valley Road, Lantau Island",22.2873842357,114.006422109,Wi-Fi.HK via CSL,1,,,False
2405,PCCW,PCCW Phone Booth,Telephone Booths,"Outside Plover Cove Garden, Polver Cove Road, Tai Po",22.457575164,114.15888756,Wi-Fi.HK via CSL,1,,,False
2419,PCCW,PCCW Phone Booth,Telephone Booths,"Outside Tin Chak Shopping Centre, Tin Shui Road, Tin Shui Wai",22.468355741,113.99922266,Wi-Fi.HK via CSL,1,,,False
2421,PCCW,PCCW Phone Booth,Telephone Booths,"Outside Tin Yiu Estate Commercial Complex, Tin Shui Wai",22.451003677,114.00288833,Wi-Fi.HK via CSL,1,,,False
2423,PCCW,PCCW Phone Booth,Telephone Booths,Outside Tuen Mun Ferry Pier,22.372295911,113.96605446,Wi-Fi.HK via CSL,1,,,False
2435,PCCW,PCCW Phone Booth,Telephone Booths,"Outside LRT Siu Hei Station, Yuet Wu Villa, Tuen Mun",22.37517787,113.96702098,Wi-Fi.HK via CSL,1,,,False
2445,PCCW,PCCW Phone Booth,Telephone Booths,"Outside Sui Lun Court Carpark Building, Heung Sze Wui Road, Tuen Mun",22.3845802153,113.975347619,Wi-Fi.HK via CSL,1,,,False
2448,PCCW,PCCW Phone Booth,Telephone Booths,"Outside Tsing Ho Square Rest Garden, Tuen Mun",22.387999146,113.97969285,Wi-Fi.HK via CSL,1,,,False
2458,PCCW,PCCW Phone Booth,Telephone Booths,"Outside Broadway Theatre Tai Pa Street, Tsuen Wan",22.371376057,114.11116069,Wi-Fi.HK via CSL,1,,,False
2468,PCCW,PCCW Phone Booth,Telephone Booths,"Bus Terminus, Shek Wai Kok Estate, Shek Wai Kok Road, Tsuen Wan",22.376158406,114.1247032,Wi-Fi.HK via CSL,1,,,False
2472,PCCW,PCCW Phone Booth,Telephone Booths,"Outside Commercial Complex, Cheung Hang Estate, Tsing Yi",22.353670147,114.09774329,Wi-Fi.HK via CSL,1,,,False
2476,PCCW,PCCW Phone Booth,Telephone Booths,"Outside Block 10, Greenfield Garden, Fung Shue Wo Road, Tsing Yi",22.353449901,114.10926685,Wi-Fi.HK via CSL,1,,,False
2477,PCCW,PCCW Phone Booth,Telephone Booths,"Outside Block 8, Villa Esplanada Promenade, Tsing Yi",22.361829416,114.10771889,Wi-Fi.HK via CSL,1,,,False
2481,PCCW,PCCW Phone Booth,Telephone Booths,"Outside Hang Chun House, Cheung Hang Estate, Tsing Yi",22.358004841,114.09794459,Wi-Fi.HK via CSL,1,,,False
2483,PCCW,PCCW Phone Booth,Telephone Booths,"Outside Po Leung Kuk College, Ching Hong Road, Tsing Yi",22.349489887,114.09934755,Wi-Fi.HK via CSL,1,,,False
2489,PCCW,PCCW Phone Booth,Telephone Booths,"Bus Terminus, Chi Fu Fa Yuen, Pok Fu Lam",22.257349302,114.13953575,Wi-Fi.HK via CSL,1,,,False
2490,PCCW,PCCW Phone Booth,Telephone Booths,"Conjunction of Shanghai Street / Jordan Road, Jordan",22.305531837,114.16950913,Wi-Fi.HK via CSL,1,,,False
2492,PCCW,PCCW Phone Booth,Telephone Booths,"Outside 3A Waterloo Road, Jordan",22.312909727,114.16960557,Wi-Fi.HK via CSL,1,,,False
2507,PCCW,PCCW Phone Booth,Telephone Booths,"Conjuction of Tai Shing Street / Tai Tung Street, Wong Tai Sin",22.337472418,114.19376413,Wi-Fi.HK via CSL,1,,,False
