LocationID,OrganisationCode,LocationNameEN,VenueTypeEN,AddressEN,Latitude,Longitude,SSID,NumberOfHotspots,MoreInformationEN,MoreInformationLinkEN,InWifiMap
NIMM024,hkgwfs,Immigration and Registration of Persons - Fo Tan Office,Government Buildings & Offices,"Shops 405 & 407, 4/F, Jubilee Square, 2-18 Lok King Street, Fo Tan, New Territories",22.396413,114.199626,Wi-Fi.HK,3,Hotspot Location in Venue,https://theme.gov.hk/en/theme/wifi/images/coverage/IMMD-24-ImmigrationandRegistrationofPersons-FoTanOffice-4F.pdf,False
NIMM032,hkgwfs,Liantang/Heung Yuen Wai Boundary Control Point - PTI,Transportation/Boundary & Related Facilities,"1/F, Liantang/Heung Yuen Wai Boundary Control Point, Ta Kwu Ling, New Territories",22.5519,114.1538,Wi-Fi.HK,7,,,False
NIMM034,hkgwfs,Shenzhen Bay Port Boundary Control Points - South Vehicle Control Point,Transportation/Boundary & Related Facilities,"South Vehicle Control Point, Shenzhen Bay Hong Kong Port",22.501124,113.948211,Wi-Fi.HK,3,Hotspot Location in Venue,https://theme.gov.hk/en/theme/wifi/images/coverage/Shenzhen Bay Port Border Contro Points and PIT_hotspotdiagram.pdf,False
NIMM035,hkgwfs,Shenzhen Bay Port Boundary Control Points - Vehicle Passengers Arrival Point at PTI,Transportation/Boundary & Related Facilities,"Vehicle Passengers Arrival Point at Public Transfer Interchange (PTI), Shenzhen Bay Hong Kong Port",22.498963,113.950164,Wi-Fi.HK,2,Hotspot Location in Venue,https://theme.gov.hk/en/theme/wifi/images/coverage/Shenzhen Bay Port Border Contro Points and PIT_hotspotdiagram.pdf,False
NIS-009,hkgwfs,Ngong Ping Road Interchange (High Speed Zone),Transportation/Boundary & Related Facilities,"Ngong Ping Road Interchange, Ngong Ping, Lantau",22.255771,113.90317,Wi-Fi.HK (High Speed),2,Hotspot Location in Venue,https://theme.gov.hk/en/theme/wifi/images/coverage/FEHD-Island-9-NgongPingRoadInterchange.pdf,False
NIS-009A,hkgwfs,Ngong Ping Road Interchange,Transportation/Boundary & Related Facilities,"Ngong Ping Road Interchange, Ngong Ping, Lantau",22.255771,113.90317,Wi-Fi.HK,2,Hotspot Location in Venue,https://theme.gov.hk/en/theme/wifi/images/coverage/FEHD-Island-9-NgongPingRoadInterchange.pdf,False
NIS-010,hkgwfs,Tung Chung North Park,Entertainment & Leisure,"No. 29 Man Tung Road, Tung Chung",22.29127,113.95031,Wi-Fi.HK,5,Hotspot Location in Venue,https://theme.gov.hk/en/theme/wifi/images/coverage/NIS-010_Tung Chung North Park_Hotspot_Diagram.pdf,False
NJSA01,njsa,New Jade Shopping Arcade,Stores/Shopping Malls,"233 Chai Wan Rd, Chai Wan, Hong Kong (MTR Exit A or E)",22.26401,114.237075,Wi-Fi.HK – NewJadeShoppingArcade,3,,,False
NKT-009,hkgwfs,Tsing Yi Sports Ground,"Sports, Cultural & Recreational Venues","No. 51 Tsing King Road,Tsing Yi, New Territories",22.35629,114.108174,Wi-Fi.HK,8,Hotspot Location in Venue,https://theme.gov.hk/en/theme/wifi/images/coverage/LCSD-KwaiTsing-9-TsingYiSportsGround-GF.pdf,False
NKT-012,hkgwfs,Wo Yi Hop Road Sports Ground,"Sports, Cultural & Recreational Venues","298 Wo Yi Hop Road, Kwai Chung, New Territories",22.374167,114.136944,Wi-Fi.HK,2,Hotspot Location in Venue,https://theme.gov.hk/en/theme/wifi/images/coverage/LCSD-KwaiTsing-12-WoYiHopRoadSportsGround.pdf,False
NKT-013,hkgwfs,Tsing Yi Southwest Sports Centre,"Sports, Cultural & Recreational Venues","70 Chung Mei Road, Tsing Yi, New Territories",22.351429,114.101895,Wi-Fi.HK,12,Hotspot Location in Venue,https://theme.gov.hk/en/theme/wifi/images/coverage/LCSD-KwaiTsing-13-TsingYiSWSC.pdf,False
NKT-014,hkgwfs,Tsing Yi Northeast Park,Entertainment & Leisure,"No. 10 Tam Kon Shan Road,Tsing Yi, New Territories",22.362407,114.098957,Wi-Fi.HK,9,Hotspot Location in Venue,https://theme.gov.hk/en/theme/wifi/images/coverage/NKT-014-TsingYiNortheastPark.pdf,False
NLD-010,hkgwfs,Tuen Mun Job Centre,Government Buildings & Offices,"G/F, Victory Building, 3 Tsing Min Path, San Hui, Tuen Mun, New Territories",22.404063,113.979253,Wi-Fi.HK,2,Hotspot Location in Venue,https://theme.gov.hk/en/theme/wifi/images/coverage/LD-10-TuenMunJobCentre.pdf,False
NLD-011,hkgwfs,Tsuen Wan Job Centre,Government Buildings & Offices,"2/F, Tsuen Wan Government Offices, 38 Sai Lau Kok Road, Tsuen Wan, New Territories",22.374638,114.115082,Wi-Fi.HK,2,Hotspot Location in Venue,https://theme.gov.hk/en/theme/wifi/images/coverage/LD-11-TsuenWanJobCentre-2F.pdf,False
NLF,NLPRA,New Life Psychiatric Rehabilitation Association - New Life Farm,Welfare Service Units,"33, San Fuk Road, Tuen Mun, N. T.",22.4105,113.97181,Wi-Fi.HK via New Life,2,,,False
NND-005,hkgwfs,North District Park,Entertainment & Leisure,"Jockey Club Road, Sheung Shui, New Territories",22.499181,114.134085,Wi-Fi.HK,13,Hotspot Location in Venue,https://theme.gov.hk/en/theme/wifi/images/coverage/LCSD-NorthDistrict-5-NorthDistrictPark.pdf,False
NND-006,hkgwfs,Po Wing Road Sports Centre,"Sports, Cultural & Recreational Venues","19 Pak Wo Road, Sheung Shui, New Territories",22.496967,114.128387,Wi-Fi.HK,10,Hotspot Location in Venue,https://theme.gov.hk/en/theme/wifi/images/coverage/LCSD-NorthDistrict-6-PoWingRoadSportsCentre.pdf,False
NND-007,hkgwfs,North District Sports Ground,"Sports, Cultural & Recreational Venues","26 Tin Ping Road, Sheung Shui, New Territories",22.506389,114.130278,Wi-Fi.HK,4,Hotspot Location in Venue,https://theme.gov.hk/en/theme/wifi/images/coverage/LCSD-NorthDistrict-7-NorthDistrictSportsGround.pdf,False
NND-008,hkgwfs,Tin Ping Sports Centre,"Sports, Cultural & Recreational Venues","3/F, Tin Ping Shopping Centre, Tin Ping Estate, Sheung Shui",22.503502,114.133494,Wi-Fi.HK,8,Hotspot Location in Venue,https://theme.gov.hk/en/theme/wifi/images/coverage/LCSD-NorthDistrict-8-TinPingSportsCentre.pdf,False
Noah-002,noahsark,Noah's Ark,Entertainment & Leisure,"33 Pak Yan Road, Ma Wan, New Territories, Hong Kong",22.348251,114.061553,Noah Public,10,Tickets,https://www.noahsark.com.hk/eng/noahs-ark-tickets.jsp,False
Noah-003,noahsark,Noah's Ark Hotel & Resort,Hotels/Guesthouses,"33 Pak Yan Road, Ma Wan, New Territories, Hong Kong",22.348239,114.061668,na_hotel,23,Room Package,https://www.noahsarkhotel.com.hk/en/main/index.html,False
Noah-004,noahsark,Solar Villas,Hotels/Guesthouses,"No.14 Tai Yuk Road, Ma Wan, New Territories, Hong Kong",22.348826,114.057175,solar_villas,38,Room & Events,https://www.noahsark.com.hk/eng/solarvillas.jsp,False
NP360-NP,np360,Ngong Ping Village,Entertainment & Leisure,"111 Ngong Ping Road, Lantau, Hong Kong",22.2567479,113.9022272,Wi-Fi.HK via NP360,13,,,False
NP360-TC,np360,Tung Chung Cable Car Terminal,Entertainment & Leisure,"11 Tat Tung Road, Tung Chung, Lantau, Hong Kong",22.290198,113.9388362,Wi-Fi.HK via NP360,13,,,False
NPAR001M,hkgwfs,Central Kwai Chung Park,Entertainment & Leisure,"San Kwai Street, Kwai Chung",22.35669,114.132551,Wi-Fi.HK,3,Hotspot Location in Venue,https://theme.gov.hk/en/theme/wifi/images/coverage/CentralKwaiChungPark.pdf,False
NPES012,hkgwfs,Islands District Office - Tung Chung Public Enquiry Service Centre,Government Buildings & Offices,"1/F, Tung Chung Post Office Building, 6 Mei Tung Street, Tung Chung, Lantau Island, New Territories",22.289197,113.939342,Wi-Fi.HK,2,Hotspot Location in Venue,https://theme.gov.hk/en/theme/wifi/images/coverage/HAD-PESC-12-IslandsDistrictOffice-TungChungPublicEnquiryServiceCentre-1F.pdf,False
NPES039,hkgwfs,North District Office - Public Enquiry Service Centre,Government Buildings & Offices,"G/F, North District Government Offices, 3 Pik Fung Road, Fanling, New Territories",22.494703,114.138193,Wi-Fi.HK,2,Hotspot Location in Venue,https://theme.gov.hk/en/theme/wifi/images/coverage/HAD-PESC-39-NorthDistrictOffice-PublicEnquiryServiceCentre-GF.pdf,False
NPES079,hkgwfs,Tai Po District Office - Public Enquiry Service Centre,Government Buildings & Offices,"G/F, Tai Po Government Offices Building, 1 Ting Kok Road, Tai Po, New Territories",22.450911,114.164193,Wi-Fi.HK,2,Hotspot Location in Venue,https://theme.gov.hk/en/theme/wifi/images/coverage/HAD-PESC-79-TaiPoDistrictOffice-PublicEnquiryServiceCentre-GF.pdf,False
NPG034M,hkgwfs,Pak Fuk Tin Sum Playground,Entertainment & Leisure,"Area 42, Yat Ming Road, Fanling",22.488641,114.140478,Wi-Fi.HK,3,Hotspot Location in Venue,https://theme.gov.hk/en/theme/wifi/images/coverage/Pak Fuk Tin Sum Playground.pdf,False
NPG036M,hkgwfs,Wai Man Road Playground,Entertainment & Leisure,"Wai Man Road, Sai Kung",22.3841462,114.274608,Wi-Fi.HK,3,Hotspot Location in Venue,https://theme.gov.hk/en/theme/wifi/images/coverage/Wai Man Road Playground.pdf,False
NPG038M,hkgwfs,Yuen Wo Playground,Entertainment & Leisure,"16 Yuen Wo Road, Sha Tin",22.38541,114.195381,Wi-Fi.HK,3,Hotspot Location in Venue,https://theme.gov.hk/en/theme/wifi/images/coverage/Yuen Wo Playground.pdf,False
NPG040M,hkgwfs,Po Heung Bridge Sitting-out Area,Entertainment & Leisure,"Po Heung Street, Tai Po",22.450158,114.167426,Wi-Fi.HK,1,Hotspot Location in Venue,https://theme.gov.hk/en/theme/wifi/images/coverage/Po Heung Bridge.pdf,False
NPG042M,hkgwfs,Yan Oi Town Square,Entertainment & Leisure,"Kai Man Path, San Hui, Tuen Mun",22.396213,113.97556,Wi-Fi.HK,3,Hotspot Location in Venue,https://theme.gov.hk/en/theme/wifi/images/coverage/Yan Oi Town square_1.pdf,False
NPG045M,hkgwfs,Tsang Tai Uk Recreation Ground,Entertainment & Leisure,"2 Sha Kok Street, Sha Tin",22.37508,114.189621,Wi-Fi.HK,4,Hotspot Location in Venue,https://theme.gov.hk/en/theme/wifi/images/coverage/Tsang Tai Uk Recreation Ground.pdf,False
NPG046M,hkgwfs,Wu Shan Recreation Playground,Entertainment & Leisure,"Wu Shan Road, Tuen Mun",22.379967,113.965901,Wi-Fi.HK,5,Hotspot Location in Venue,https://theme.gov.hk/en/theme/wifi/images/coverage/Wu Shan Recreation Playground.pdf,False
NPL-009,hkgwfs,Cheung Chau Public Library,"Sports, Cultural & Recreational Venues","2/F, Cheung Chau Municipal Services Building, 2 Tai Hing Tai Road, Cheung Chau, New Territories",22.20682,114.028345,Wi-Fi.HK,3,Hotspot Location in Venue,https://theme.gov.hk/en/theme/wifi/images/coverage/LCSD-PL-9-CheungChauPublicLibrary-2F.pdf,False
NPL-011,hkgwfs,Fanling Public Library,"Sports, Cultural & Recreational Venues","2/F, 9 Wo Mun Street, Fanling, New Territories",22.500142,114.144736,Wi-Fi.HK,9,Hotspot Location in Venue,https://theme.gov.hk/en/theme/wifi/images/coverage/LCSD-PL-11-FanlingPublicLibrary-2F.pdf,False
NPL-017,hkgwfs,North Kwai Chung Public Library,"Sports, Cultural & Recreational Venues","2/F & 3/F, North Kwai Chung Market & Library, Shek Yam Road, Kwai Chung, New Territories",22.3706,114.138609,Wi-Fi.HK,8,Hotspot Location in Venue,https://theme.gov.hk/en/theme/wifi/images/coverage/LCSD-PL-17-NorthKwaiChungPublicLibrary.pdf,False
NPL-024,hkgwfs,Sheung Shui Public Library,"Sports, Cultural & Recreational Venues","3/F, Shek Wu Hui Municipal Services Building, 13 Chi Cheong Road, Sheung Shui, New Territories",22.50216,114.130736,Wi-Fi.HK,8,Hotspot Location in Venue,https://theme.gov.hk/en/theme/wifi/images/coverage/LCSD-PL-24-SheungShuiPublicLibrary-3F.pdf,False
NPL-026,hkgwfs,South Kwai Chung Public Library,"Sports, Cultural & Recreational Venues","4/F, Kwai Hing Government Offices, 166-174, Hing Fong Road, Kwai Chung, New Territories",22.36313,114.131534,Wi-Fi.HK,6,Hotspot Location in Venue,https://theme.gov.hk/en/theme/wifi/images/coverage/LCSD-PL-26-SouthKwaiChungPublicLibrary-4F.pdf,False
NPL-027,hkgwfs,Tai Hing Public Library,"Sports, Cultural & Recreational Venues","Unit No. 80, 1/F, Commercial Complex, Tai Hing Estate, Tuen Mun, New Territories",22.402309,113.970175,Wi-Fi.HK,3,Hotspot Location in Venue,https://theme.gov.hk/en/theme/wifi/images/coverage/LCSD-PL-27-TaiHingPublicLibrary-1F.pdf,False
NPL-043,hkgwfs,Lek Yuen Public Library,"Sports, Cultural & Recreational Venues","Units 101-110, G/F, Kwai Wo House, Lek Yuen Estate, Sha Tin, New Territories",22.384855,114.190681,Wi-Fi.HK,4,Hotspot Location in Venue,https://theme.gov.hk/en/theme/wifi/images/coverage/LCSD-PL-43-LekYuenPublicLibrary-GF.pdf,False
NPL-047,hkgwfs,North Lamma Public Library,"Sports, Cultural & Recreational Venues","1 Yung Shue Wan Main Street, Lamma Island, Hong Kong",22.227156,114.109613,Wi-Fi.HK,3,Hotspot Location in Venue,https://theme.gov.hk/en/theme/wifi/images/coverage/LCSD-PL-47-NorthLammaPublicLibrary.pdf,False
NPL-056,hkgwfs,South Lamma Public Library,"Sports, Cultural & Recreational Venues","G/F, Second Street, Sok Kwu Wan, Lamma Island, New Territories",22.205918,114.131715,Wi-Fi.HK,2,Hotspot Location in Venue,https://theme.gov.hk/en/theme/wifi/images/coverage/LCSD-PL-56-SouthLammaPublicLibrary-GF.pdf,False
NPL-060,hkgwfs,Tin Shui Wai North Public Library,"Sports, Cultural & Recreational Venues","Shop 313, Tin Chak Shopping Centre, Tin Chak Estate, Tin Shui Wai, New Territories",22.468418,113.998659,Wi-Fi.HK,4,Hotspot Location in Venue,https://theme.gov.hk/en/theme/wifi/images/coverage/LCSD-PL-60-TinShuiWaiNorthPublicLibrary-3F.pdf,False
NPL-067,hkgwfs,Tung Chung Public Library,"Sports, Cultural & Recreational Venues","G/F to 1/F, Tung Chung Municipal Services Building, 39 Man Tung Road, Tung Chung, Lantau Island, New Territories",22.290567,113.943736,Wi-Fi.HK,10,Hotspot Location in Venue,https://theme.gov.hk/en/theme/wifi/images/coverage/LCSD-PL-67-TungChungPublicLibrary.pdf,False
NPMN10M,hkgwfs,Shing Mun River Promenade No.2,Entertainment & Leisure,"55 Tai Chung Kiu Road, Sha Tin",22.389382,114.20245,Wi-Fi.HK,2,Hotspot Location in Venue,https://theme.gov.hk/en/theme/wifi/images/coverage/Shing Mun River Promenade No2.pdf,False
NPMN11M,hkgwfs,Shing Mun River Promenade No.3,Entertainment & Leisure,"Yuen Wo Road, Sha Tin",22.388826,114.19891,Wi-Fi.HK,4,Hotspot Location in Venue,https://theme.gov.hk/en/theme/wifi/images/coverage/Shing Mun River Promenade No3.pdf,False
NPMN12M,hkgwfs,Ma On Shan Promenade,Entertainment & Leisure,"Ning Tai Road, Ma On Shan",22.40901,114.220554,Wi-Fi.HK,5,Hotspot Location in Venue,https://theme.gov.hk/en/theme/wifi/images/coverage/Ma On Shan Promenade.pdf,False
NPRK29M,hkgwfs,Tuen Mun Park (Near Model Boat Pool),Entertainment & Leisure,"Tuen Mun Heung Sze Wui Road, Tuen Mun",22.39275,113.973588,Wi-Fi.HK,4,Hotspot Location in Venue,https://theme.gov.hk/en/theme/wifi/images/coverage/Tuen Mun Park.pdf,False
NPRK30M,hkgwfs,Butterfly Beach Park,Entertainment & Leisure,"Area 45, Lung Mun Road, Tuen Mun",22.374,113.958,Wi-Fi.HK,2,Hotspot Location in Venue,https://theme.gov.hk/en/theme/wifi/images/coverage/Butterfly Beach Park.pdf,False
NPRK31M,hkgwfs,Tin Yip Road Park,Entertainment & Leisure,"Tin Yip Road, Tin Shui Wai",22.463641,114.006697,Wi-Fi.HK,3,Hotspot Location in Venue,https://theme.gov.hk/en/theme/wifi/images/coverage/Tin Yip Road Park.pdf,False
NPRK32M,hkgwfs,Hang Hau Man Kuk Lane Park,Entertainment & Leisure,"6 Man Kuk Lane, Hang Hau, Tseung Kwan O",22.3131,114.2653,Wi-Fi.HK,4,Hotspot Location in Venue,https://theme.gov.hk/en/theme/wifi/images/coverage/Hang Hau Man Kuk Lane.pdf,False
NPRK33M,hkgwfs,Man Tung Road Park,Entertainment & Leisure,"55 Man Tung Road, Tung Chung",22.291919,113.940943,Wi-Fi.HK,3,Hotspot Location in Venue,https://theme.gov.hk/en/theme/wifi/images/coverage/Man Tung Road Park.pdf,False
NPRO006,hkgwfs,Tuen Mun Promenade,Entertainment & Leisure,"280 Wu Chui Road, Tuen Mun",22.371305,113.971015,Wi-Fi.HK,9,Hotspot Location in Venue,https://theme.gov.hk/en/theme/wifi/images/coverage/LCSD-Prom-6-TuenMunPromenade.pdf,False
NRCO003,hkgwfs,Tung Chung Rural Committee's office,Village Premises,"12A Sheung Ling Pei, Lantau Island",22.27888,113.93901,Wi-Fi.HK,2,Hotspot Location in Venue,https://theme.gov.hk/en/theme/wifi/images/coverage/SC4-RC-TungChungRuralCommitteeoffice.pdf,False
NRCO010,hkgwfs,Ping Shan Rural Committee's office,Village Premises,"139 Yuen Long On Ning Rd, Yuen Long",22.44601,114.02327,Wi-Fi.HK,3,Hotspot Location in Venue,https://theme.gov.hk/en/theme/wifi/images/coverage/Ping Shen Rural Committee's office_hotspot_diagram.pdf,False
NRCO012,hkgwfs,Pat Heung Rural Committee's office,Village Premises,"4V Sheung Tsuen, Pat Heung, Yuen Long, New Territories",22.43268,114.10293,Wi-Fi.HK,3,"Hotspot Location in Venue
",https://theme.gov.hk/en/theme/wifi/images/coverage/Pat Heung Rural Committee's office_hotpost_diagram.pdf,False
NRCO013,hkgwfs,Kam Tin Rural Committee's office,Village Premises,"133 Kam Tin Rd, Kam Tin, Yuen Long",22.4401,114.06582,Wi-Fi.HK,1,Hotspot Location in Venue,https://theme.gov.hk/en/theme/wifi/images/coverage/Kam Tin Rural Committee's office_hotspot_diagram.pdf,False
NRCO016,hkgwfs,Fanling District Rural Committee's office,Village Premises,"3 Luen Fat Street, Luen Wo Hui, Fanling",22.49783,114.14207,Wi-Fi.HK,2,"Hotspot Location in Venue
",https://theme.gov.hk/en/theme/wifi/images/coverage/Fanling Rural Committee's office_hotspot_diagram_v2.pdf,False
NRCO017,hkgwfs,Sheung Shui District Rural Committee's office,Village Premises,"3 Po Wan Road, Sheung Shui",22.50521,114.12644,Wi-Fi.HK,2,Hotspot Location in Venue,https://theme.gov.hk/en/theme/wifi/images/coverage/Sheung Shui District Rural Committee's office_hotspot_diagram.pdf,False
NRCO018,hkgwfs,Ta Kwu Ling District Rural Committee Office,Village Premises,"198 Ping Che Road, Ta Kwu Ling",22.53114,114.15426,Wi-Fi.HK,3,Hotspot Location in Venue,https://theme.gov.hk/en/theme/wifi/images/coverage/SC4-RC-TaKwuLingDistrictRuralCommitteeOffice.pdf,False
NRCO019,hkgwfs,Sha Tau Kok District Rural Committee's office,Village Premises,"Sha Tau Kok Road, Sha Tau Kok, New Territories, Hong Kong",22.54537,114.22278,Wi-Fi.HK,2,"Hotspot Location in Venue
",https://theme.gov.hk/en/theme/wifi/images/coverage/Sha Tau Kok Rural Committee's office_hotspot_diagram.pdf,False
NRCO020,hkgwfs,Sai Kung Rural Committee Office,Village Premises,"1 Rural Committee Lane, Sai Kung",22.38062,114.2699,Wi-Fi.HK,2,Hotspot Location in Venue,https://theme.gov.hk/en/theme/wifi/images/coverage/SC4-RC-SaiKungRuralCommitteeOffice.pdf,False
NRCO021,hkgwfs,Hang Hau Rural Committee's office,Village Premises,"No. 1, Hang Hau Rd., Clear Water Bay, N.T.",22.31887,114.27125,Wi-Fi.HK,3,"Hotspot Location in Venue
",https://theme.gov.hk/en/theme/wifi/images/coverage/Hang Hau Rural Committee's office_hotpost_diagram.pdf,False
NRCO023,hkgwfs,Tai O Rural Committee's office,Village Premises,"29 Market Street, Tai O, Lantau Island",22.25473,113.86231,Wi-Fi.HK,2,Hotspot Location in Venue,https://theme.gov.hk/en/theme/wifi/images/coverage/SC4-RC-TaiORuralCommitteeoffice.pdf,False
NRCO024,hkgwfs,Mui Wo Rural Committee's office,Village Premises,"45 Mui Wo Rural Committee Road, Mui Wo",22.267698,113.996061,Wi-Fi.HK,2,Hotspot Location in Venue,https://theme.gov.hk/en/theme/wifi/images/coverage/Mui Wo Rural Committee's office_hotspot_diagram.pdf,False
NSC,hkia,"North Satellite Concourse, Hong Kong International Airport",Transportation/Boundary & Related Facilities,"North Satellite Concourse, Hong Kong International Airport, Lantau, Hong Kong",22.317157,113.930225,Wi-Fi.HK via HKAirport,20,,,False
NSK-002,hkgwfs,Tsui Lam Sports Centre,"Sports, Cultural & Recreational Venues","G/F, 1-2/F, Tsui Lam Estate, Tseung Kwan O, New Territories",22.322233,114.249523,Wi-Fi.HK,8,Hotspot Location in Venue,https://theme.gov.hk/en/theme/wifi/images/coverage/LCSD-SaiKung-2-TsuiLamSportsCentre.pdf,False
NSK-004,hkgwfs,Po Hong Park,Entertainment & Leisure,"Wan Lung Road, Tseung Kwan O, New Territories",22.318784,114.257645,Wi-Fi.HK,7,Hotspot Location in Venue,https://theme.gov.hk/en/theme/wifi/images/coverage/LCSD-SaiKung-4-PoHongPark.pdf,False
NSK-005,hkgwfs,Po Tsui Park,Entertainment & Leisure,"Yuk Nga Lane, Tseung Kwan O, New Territories",22.325032,114.25298,Wi-Fi.HK,5,Hotspot Location in Venue,https://theme.gov.hk/en/theme/wifi/images/coverage/LCSD-SaiKung-5-PoTsuiPark.pdf,False
NSK-008,hkgwfs,Sai Kung Outdoor Recreation Centre,Entertainment & Leisure,"21, Hong Kin Road,Tui Min Hoi Area, Sai Kung, New Territories",22.376395,114.269178,Wi-Fi.HK,14,Hotspot Location in Venue,https://theme.gov.hk/en/theme/wifi/images/coverage/LCSD-SaiKung-8-SaiKungOutdoorRecreationCentre-GF.pdf,False
NSK-009,hkgwfs,Lady MacLehose Holiday Village,Entertainment & Leisure,"Pak Tam, Sai Kung, New Territories",22.408015,114.321766,Wi-Fi.HK,19,Hotspot Location in Venue,https://theme.gov.hk/en/theme/wifi/images/coverage/LCSD-SaiKung-9-LadyMacLehoseHolidayVillage.pdf,False
NSK-012,hkgwfs,Tiu Keng Leng Sports Centre,"Sports, Cultural & Recreational Venues","2 Chui Ling Road, Tiu Keng Leng, Tseung Kwan O, New Territories",22.306389,114.255278,Wi-Fi.HK,16,Hotspot Location in Venue,https://theme.gov.hk/en/theme/wifi/images/coverage/LCSD-SaiKung-12-TiuKengLengSportsCentre.pdf,False
NSK-013,hkgwfs,Hong Kong Velodrome Park,Entertainment & Leisure,"105-107, Po Hong Road, Tseung Kwan O, New Territories",22.313611,114.261667,Wi-Fi.HK,3,Hotspot Location in Venue,https://theme.gov.hk/en/theme/wifi/images/coverage/LCSD-SaiKung-13-HongKongVelodromePark-Skatepark.pdf,False
NSP009M,hkgwfs,Chong Hing Water Sports Centre,"Sports, Cultural & Recreational Venues","West Sea Cofferdam, High Island Reservoir, Sai Kung",22.3772,114.3356,Wi-Fi.HK,2,Hotspot Location in Venue,https://theme.gov.hk/en/theme/wifi/images/coverage/NSP009M-ChongHingWaterSportsCentre.pdf,False
NSP010M,hkgwfs,The Jockey Club Wong Shek Water Sports Centre,"Sports, Cultural & Recreational Venues","Wong Shek Pier, Sai Kung",22.433954,114.337258,Wi-Fi.HK,3,Hotspot Location in Venue,https://theme.gov.hk/en/theme/wifi/images/coverage/Wong Shek Water sport centre.pdf,False
NSP012M,hkgwfs,Tai Mei Tuk Water Sports Centre,"Sports, Cultural & Recreational Venues","Main Dam, Plover Cove Reservoir, Tai Mei Tuk, Tai Po",22.46822,114.233503,Wi-Fi.HK,4,Hotspot Location in Venue,https://theme.gov.hk/en/theme/wifi/images/coverage/NSP012M-TaiMeiTukWaterSportsCentre.pdf,False
NSP013M,hkgwfs,Sai Ching Street Tennis Courts,"Sports, Cultural & Recreational Venues","6 Sai Ching Street, Yuen Long",22.441578,114.027195,Wi-Fi.HK,2,Hotspot Location in Venue,https://theme.gov.hk/en/theme/wifi/images/coverage/Sai Ching Street Tennis Courts.pdf,False
NSP014M,hkgwfs,Kwu Tung Grass Soccer Pitch,"Sports, Cultural & Recreational Venues","3 Ho Sheung Heung Road, Kwu Tung, Sheung Shui",22.504508,114.099716,Wi-Fi.HK,2,"Hotspot Location in Venue
",https://theme.gov.hk/en/theme/wifi/images/coverage/Kwu Tung Grass Soccer Pitch.pdf,False
NSP018M,hkgwfs,Wu Shan Tennis Court,"Sports, Cultural & Recreational Venues","Wu Shan Road, Tuen Mun",22.376789,113.967817,Wi-Fi.HK,2,Hotspot Location in Venue,https://theme.gov.hk/en/theme/wifi/images/coverage/Wu Shan Tennis Court.pdf,False
NSP021M,hkgwfs,Yuen Long Jockey Club Squash Courts,"Sports, Cultural & Recreational Venues","32 Kin Tak Street, Yuen Long",22.44082,114.030078,Wi-Fi.HK,2,Hotspot Location in Venue,https://theme.gov.hk/en/theme/wifi/images/coverage/NSP021M-YuenLongJockeyClubSquashCourts.pdf,False
NSP027M,hkgwfs,Yuen Wo Road Sports Centre (Dragon Boat Pavilion),Entertainment & Leisure,"8 Yuen Wo Road, Sha Tin",22.382514,114.19315,Wi-Fi.HK,2,Hotspot Location in Venue,https://theme.gov.hk/en/theme/wifi/images/coverage/NSP027M_Yuen Wo Road Sports Centre (Dragon Boat Pavilion)_Hotspot_Diagram.pdf,False
NST-003,hkgwfs,Heng On Sports Centre,"Sports, Cultural & Recreational Venues","4/F, Heng On Commercial Centre, Heng On Estate, Ma On Shan, New Territories",22.41669,114.227853,Wi-Fi.HK,7,Hotspot Location in Venue,https://theme.gov.hk/en/theme/wifi/images/coverage/LCSD-ShaTin-3-HengOnSportsCentre.pdf,False
NST-006,hkgwfs,Ma On Shan Sports Centre,"Sports, Cultural & Recreational Venues","G/F, 1/F, 14 On Chun Street, Ma On Shan, Sha Tin, New Territories",22.426026,114.229546,Wi-Fi.HK,13,Hotspot Location in Venue,https://theme.gov.hk/en/theme/wifi/images/coverage/LCSD-ShaTin-6-MaOnShanSportsCentre.pdf,False
NST-008,hkgwfs,City Art Square,Entertainment & Leisure,"1 Yuen Wo Road, Sha Tin, New Territories",22.380643,114.188536,Wi-Fi.HK,6,Hotspot Location in Venue,https://theme.gov.hk/en/theme/wifi/images/coverage/LCSD-ShaTin-8-CityArtSquare.pdf,False
NST-009,hkgwfs,Yuen Chau Kok Sports Centre,"Sports, Cultural & Recreational Venues","35 Ngan Shing Street, Sha Tin, New Territories",22.379905,114.204462,Wi-Fi.HK,12,Hotspot Location in Venue,https://theme.gov.hk/en/theme/wifi/images/coverage/LCSD-ShaTin-9-YuenCha KokSportsCentre.pdf,False
NST-010,hkgwfs,Ma On Shan Sports Ground,"Sports, Cultural & Recreational Venues","No. 1 Hang Hong Street, Ma On Shan, New Territories",22.420998,114.227871,Wi-Fi.HK,9,Hotspot Location in Venue,https://theme.gov.hk/en/theme/wifi/images/coverage/LCSD-ShaTin-10-MaOnShanSportsGround.pdf,False
NTD-002,hkgwfs,"Sha Tin Licensing Office, Transport Department",Government Buildings & Offices,"2/F, Sha Tin Government Offices, 1 Sheung Wo Che Road, Sha Tin, New Territories",22.385551,114.186894,Wi-Fi.HK,2,Hotspot Location in Venue,"https://theme.gov.hk/en/theme/wifi/images/coverage/TD-2-ShaTinLicensingOffice,TransportDepartment-2F.pdf",False
NTD-010,hkgwfs,Transport Department Vehicle Examination Complex (TDVEC),Government Buildings & Offices,"Transport Department Vehicle Examination Complex, G/F, 1/F and 2/F, 18 Sai Tso Wan Road, Tsing Yi",22.34375,114.09531,Wi-Fi.HK,10,Hotspot Location in Venue,https://theme.gov.hk/en/theme/wifi/images/coverage/NTD-010 Transport Department Vehicle Examination Complex (TDVEC).pdf,False
NTD-012,hkgwfs,Ma Liu Shui Ferry Pier,Transportation/Boundary & Related Facilities,"Science Park Road, Ma Liu Shui, Sha Tin, New Territories",22.41717,114.21443,Wi-Fi.HK,1,Hotspot Location in Venue,https://theme.gov.hk/en/theme/wifi/images/coverage/NTD-012_Ma Liu Shui Ferry Pier_Hotspot_Diagram.pdf,False
NTKFU17F,swd,Social Welfare Department,Government Buildings & Offices,"Rm. 16-19, 17/F, Nan Fung Commercial Centre, 19 Lam Lok Street, Kowloon Bay, Kowloon",22.323,114.20778,Wi-Fi.HK via SWD,2,,,False
NTKIFSC3F,swd,Social Welfare Department,Government Buildings & Offices,"3/F, Podium Level, Sheung Yuet House, Upper Ngau Tau Kok Estate, Kwun Tong, Kowloon",22.3185,114.2174,Wi-Fi.HK via SWD,3,,,False
